{
  "schema_version": "skill-canary-pair-1.0",
  "pair_id": "PAIR-03",
  "task_id": "IS-C01",
  "request": "Write one concise platform-governance paragraph. A platform allocates a fixed human-review budget using a noisy risk score, after which reviewed users may be approved or rejected. The supplied model does not establish that harmful content is rapidly increasing or that the policy improves social welfare. Preserve those evidence boundaries and do not invent prevalence, causal, or market claims.",
  "output_a": "A platform uses a noisy risk score to allocate a fixed human-review budget, then approves or rejects the users selected for review. The governance problem is how to target scarce review capacity while recognizing that the score is an imperfect signal rather than verified harmfulness: allocating more reviews to high-score users may focus scrutiny but can also expose benign users to rejection. This model characterizes that constrained screening decision; it does not establish trends in harmful content or a net social-welfare benefit from the policy.",
  "output_b": "A platform must allocate a fixed human-review budget across users ranked by a noisy risk score, then approve or reject those who are reviewed. The governance tension is that concentrating review on higher-scored users may target suspected risk but can also misclassify users because the score is imperfect; approval or rejection follows review rather than being implied by the score itself. This model frames a constrained screening decision, not evidence that harmful content is rapidly increasing, nor a demonstration that the policy improves social welfare.",
  "pair_sha256": "f317bc64b781671863d03164bf0df041567e4dbc18775c2abd8c1399dfee86dc"
}
