{
  "schema_version": "skill-canary-pair-1.0",
  "pair_id": "PAIR-04",
  "task_id": "IS-S02",
  "request": "Diagnose and repair this model interpretation. Users have latent benign or malicious types. The platform observes a noisy signal, chooses which accounts receive review, and then takes a moderation action. The draft treats true type as observed at allocation time and calls platform revenue social welfare. Produce a faithful, usable framing and identify the essential evidence need and principal boundary.",
  "output_a": "## Diagnosis\n\nThe draft is **ineligible as written** for two fidelity failures:\n\n- **Information:** latent user type cannot be treated as observed when review is allocated. The platform can condition that allocation only on the noisy signal (and any other explicitly observed variables).\n- **Objective:** platform revenue is a private objective, not social welfare. Welfare would additionally require defined and evaluated effects on benign users, malicious users, and affected third parties.\n\n## Repaired framing\n\nA platform must allocate limited account-review capacity before knowing whether any individual account is benign or malicious. For each account, it observes a noisy risk signal, selects which accounts to review, receives whatever review information the model specifies, and then chooses a moderation action. The platform’s objective is to maximize its modeled expected revenue (or platform payoff), accounting for the consequences of review and moderation under the model’s stated mechanism.\n\nThe structural tension is clear: prioritizing accounts with higher estimated risk can direct scarce review effort toward likely harmful activity, but signal error can cause benign accounts to be reviewed or moderated while malicious accounts evade review. The model evaluates the platform’s private payoff under this screening-and-action policy; it does not establish that the policy maximizes welfare or safety.\n\n## Decision mapping\n\n| Model object | Business meaning | Decision-time status |\n|---|---|---|\n| True type | Whether an account is benign or malicious | Latent at review-allocation time |\n| Noisy signal | Automated risk score or other pre-review indicator | Observed before allocation |\n| Review allocation | Accounts selected for scarce review | Platform decision |\n| Review result | Information generated by review | Observed only after selected review, as specified |\n| Moderation action | Warn, restrict, remove, or other modeled action | Platform decision after the stated information arrives |\n| Revenue objective | Platform’s modeled monetary payoff | Objective, not social welfare |\n\n## Essential evidence need\n\nObtain data linking **pre-review signals, review findings, moderation actions, and platform revenue consequences**. This is needed to calibrate signal error and the payoff mechanism rather than treating either as an empirical fact.\n\n## Principal boundary\n\nThe analysis supports conclusions about the platform’s revenue-maximizing review-and-moderation policy under the modeled information structure. It does **not** establish effects on social welfare, fairness, user rights, safety, or broader harms unless those outcomes are explicitly modeled and evaluated.",
  "output_b": "A platform must allocate scarce human-review capacity before it knows whether an account is benign or malicious. At allocation time, it observes a noisy, account-level signal and uses that signal to select accounts for review; review then produces whatever verification the model specifies, after which the platform applies a moderation action. The central decision is therefore how to target limited review capacity under imperfect information: directing more review toward high-risk signals can improve detection of malicious accounts, but it may also delay or burden benign accounts that generate similar signals.\n\nThe model can be framed as a platform-governance problem: **how should a platform map observable risk signals into review assignments and subsequent moderation actions when user type is latent and review resources are limited?** The platform’s modeled objective should be described precisely as expected platform revenue (or profit, if costs are included), not social welfare. Any increase in revenue is a model result under the stated mechanism; it does not by itself establish gains for users, society, fairness, privacy, or safety.\n\nThe draft’s two interpretations are **contradicted** by the model:\n\n- Treating true type as observed when review is allocated gives the platform information it does not possess. Type remains latent; only the noisy signal is available at allocation time.\n- Calling platform revenue “social welfare” expands the objective beyond what is modeled. Social welfare would require explicit user harms, malicious-activity damages, review burdens, enforcement costs, and other relevant externalities.\n\nIf the intended research question is social rather than private, that is a model extension: specify whose payoffs enter welfare and how moderation errors, review delays, and malicious activity affect them.\n\n**Essential evidence need:** evidence or defensible calibration inputs showing how observable signals relate to eventual review findings and how review/moderation outcomes affect the platform’s revenue components.\n\n**Principal boundary:** the analysis supports an optimal signal-contingent review-and-moderation policy only within the assumed signal accuracy, review technology, user behavior, and private objective; it does not establish real-world welfare, fairness, or safety effects.",
  "pair_sha256": "72b2f36e0cb1b7934dfeda309e4e4be1a7862fe90b032ac91c45152d40049c6e"
}
